{
  "$schema": "../../../schemas/component-contract.schema.json",
  "schemaVersion": 1,
  "id": "ai:ai-chip-brief",
  "slug": "ai-chip-brief",
  "name": "AIChipBrief",
  "description": "A status chip for agent task briefs: default, ready, missing, edited, waiting-approval, running. The status word renders as text beside the label, never as colour alone.",
  "intent": "Whether an agent task brief is ready to run — and whether a human still has to say yes.",
  "status": "stable",
  "layer": "atoms",
  "runtime": {
    "kind": "react",
    "platforms": [
      "web",
      "react"
    ],
    "importPath": "@/components/ai/ai-chip-brief",
    "exports": [
      "AIChipBrief",
      "aiChipBriefVariants"
    ],
    "implementation": "src/components/ai/ai-chip-brief.tsx"
  },
  "figma": {
    "fileKey": null,
    "nodeId": null,
    "url": null
  },
  "codeConnect": {
    "mapped": false,
    "url": null,
    "component": null
  },
  "props": [
    {
      "name": "status",
      "type": "\"default\" | \"ready\" | \"missing\" | \"edited\" | \"waiting-approval\" | \"running\"",
      "required": false,
      "default": "\"default\"",
      "hint": "One of the status values declared in aiChipBriefVariants."
    },
    {
      "name": "size",
      "type": "\"sm\" | \"md\"",
      "required": false,
      "default": "\"md\"",
      "hint": "One of the size values declared in aiChipBriefVariants."
    },
    {
      "name": "label",
      "type": "string",
      "required": true,
      "hint": "Required. Declared in the component source."
    },
    {
      "name": "className",
      "type": "string",
      "required": false,
      "hint": "Merged with the component classes via cn(). Use for layout only — never to override a variant that already exists."
    }
  ],
  "variants": [
    {
      "group": "variant",
      "name": "default",
      "when": "Draft. Not yet complete."
    },
    {
      "group": "variant",
      "name": "ready",
      "when": "All inputs present. Can run."
    },
    {
      "group": "variant",
      "name": "missing",
      "when": "Required information absent."
    },
    {
      "group": "variant",
      "name": "edited",
      "when": "A human changed the agent-generated brief."
    },
    {
      "group": "variant",
      "name": "waiting-approval",
      "when": "The state that matters — a human must approve before it runs."
    },
    {
      "group": "variant",
      "name": "running",
      "when": "Executing now."
    },
    {
      "group": "status",
      "name": "default"
    },
    {
      "group": "status",
      "name": "ready"
    },
    {
      "group": "status",
      "name": "missing"
    },
    {
      "group": "status",
      "name": "edited"
    },
    {
      "group": "status",
      "name": "waiting-approval"
    },
    {
      "group": "status",
      "name": "running"
    }
  ],
  "states": [
    {
      "name": "Draft",
      "when": "`status=\"default\"`"
    },
    {
      "name": "Ready",
      "when": "`status=\"ready\"`"
    },
    {
      "name": "Missing information",
      "when": "`status=\"missing\"`"
    },
    {
      "name": "Edited",
      "when": "`status=\"edited\"`"
    },
    {
      "name": "Waiting for approval",
      "when": "`status=\"waiting-approval\"`"
    },
    {
      "name": "Running",
      "when": "`status=\"running\"`"
    }
  ],
  "sizes": [
    "sm",
    "md"
  ],
  "tokens": {
    "semantic": [
      "ai-accent",
      "ai-confidence-high",
      "ai-signal",
      "ai-surface",
      "border",
      "destructive",
      "muted"
    ],
    "utilities": [
      "bg-ai-confidence-high",
      "bg-ai-signal",
      "bg-ai-surface",
      "bg-destructive",
      "bg-muted",
      "border-ai-accent",
      "border-ai-confidence-high",
      "border-ai-signal",
      "border-border",
      "border-destructive",
      "text-ai-accent",
      "text-ai-confidence-high",
      "text-ai-signal",
      "text-destructive",
      "text-muted"
    ]
  },
  "a11y": {
    "role": "none",
    "keyboard": [],
    "requiredAttributes": [
      "label"
    ],
    "notes": [
      "The status word appears both visually and in an sr-only span, so the tint is never the sole carrier of meaning."
    ],
    "handledByRadix": false
  },
  "usage": [
    "In a list of agent task briefs",
    "Wherever readiness to execute must be scannable",
    "Before an agent run is triggered"
  ],
  "doNotUse": [
    "For execution state once running — use ai:ai-queue-badge",
    "As a general badge — use ui:badge",
    "As a button",
    "Interactive use",
    "Colour-only status",
    "Generic badging"
  ],
  "governance": {
    "namespace": "ai",
    "brand": "Guild",
    "closedWorldIndexed": true,
    "agentRules": [
      "Never a button.",
      "waiting-approval must mean a human genuinely has to approve.",
      "Use ai:ai-queue-badge once it is executing."
    ],
    "related": [
      {
        "id": "ai:ai-queue-badge",
        "note": "Execution state"
      },
      {
        "id": "ui:badge",
        "note": "Generic status"
      }
    ],
    "experienceMetadata": {
      "experienceMode": [
        "AI Led"
      ],
      "aiBehavior": [
        "Suggest"
      ],
      "accountability": [
        "Attribution",
        "Approval"
      ],
      "humanGestureRequired": false,
      "reversible": "not-applicable"
    }
  },
  "sources": {
    "spec": "design-system/components/ai/ai-chip-brief/ai-chip-brief.md",
    "manifest": "design-system/components/ai/ai-chip-brief/ai-chip-brief.agent.json",
    "implementation": "src/components/ai/ai-chip-brief.tsx",
    "prompt": "design-system/components/ai/ai-chip-brief/agentic-prompt.md",
    "preview": "design-system/components/ai/ai-chip-brief/ai-chip-brief.preview.html",
    "contract": "design-system/components/ai/ai-chip-brief/ai-chip-brief.contract.json"
  },
  "gaps": [
    {
      "field": "figma",
      "reason": "No Figma file, node, or Code Connect mapping in the spec or manifest."
    },
    {
      "field": "codeConnect",
      "reason": "No Code Connect mapping declared."
    }
  ],
  "origin": {
    "generated": true,
    "curated": false,
    "generatedAt": "2026-09-15T00:18:05.777Z",
    "from": [
      "md",
      "agent.json",
      "tsx"
    ]
  }
}
