{
  "$schema": "../../../../schemas/component-contract.schema.json",
  "schemaVersion": 1,
  "id": "ai:ai-command-center-dialog",
  "slug": "ai-command-center-dialog",
  "name": "AICommandCenterDialog",
  "description": "AICommandCenterDialog is the composable conversation layer extracted from the AI Command Center page pattern. It ships two variants: robust (the full centred greeting → input card → quick action chips experience seen on the Command Center home state) and slim (a compact avatar + greeting row above a pill-shaped input bar). Both variants support full conversation threading, loading indicators, and smart-scroll behaviour via the shared useAIChat hook. Use this component when you need a first-class AI chat experience embedded inside an existing product surface — without pulling in the full-page shell, background gradients, and routing concerns of the page pattern.",
  "intent": "The conversational core of the AI Command Center — independently composable in any surface that needs a first-class AI chat experience without the full page shell.",
  "status": "experimental",
  "layer": "organisms",
  "runtime": {
    "kind": "react",
    "platforms": [
      "web",
      "react"
    ],
    "importPath": "@/components/ai/organisms/ai-command-center-dialog/AICommandCenterDialog",
    "exports": [
      "AICommandCenterDialog"
    ],
    "implementation": "src/components/ai/organisms/ai-command-center-dialog/AICommandCenterDialog.tsx"
  },
  "figma": {
    "fileKey": null,
    "nodeId": null,
    "url": null
  },
  "codeConnect": {
    "mapped": false,
    "url": null,
    "component": null
  },
  "props": [
    {
      "name": "variant",
      "type": "CommandCenterVariant",
      "required": false
    },
    {
      "name": "theme",
      "type": "CommandCenterTheme",
      "required": false
    },
    {
      "name": "greeting",
      "type": "string",
      "required": false
    },
    {
      "name": "subtitle",
      "type": "string",
      "required": false
    },
    {
      "name": "showBackground",
      "type": "boolean",
      "required": false
    },
    {
      "name": "onSubmit",
      "type": "(text: string) => void",
      "required": false
    },
    {
      "name": "titleSize",
      "type": "CommandCenterTitleSize",
      "required": false
    },
    {
      "name": "maxWidth",
      "type": "number | string",
      "required": false
    },
    {
      "name": "backdropColor",
      "type": "string",
      "required": false
    }
  ],
  "variants": [
    {
      "group": "variant",
      "name": "robust"
    }
  ],
  "states": [],
  "sizes": [
    "md",
    "lg"
  ],
  "tokens": {
    "semantic": [],
    "utilities": [],
    "ai": [
      "AI.color.action.primary",
      "AI.color.text.onAction",
      "AI.gradient.action.full",
      "AI.shadow.action.emphasis",
      "AI.shadow.input.default",
      "AI.shadow.input.focus"
    ]
  },
  "a11y": {
    "role": "group",
    "keyboard": [
      "Ensure keyboard focus order matches visual order"
    ],
    "requiredAttributes": [],
    "notes": [],
    "placeholder": true
  },
  "usage": [
    "Embedding a full AI chat experience inside an existing product page without its own route",
    "Compact surfaces that need slim-variant input without the full Command Center page shell",
    "Any surface where the AI Command Center greeting + chip pattern is the right interaction model"
  ],
  "doNotUse": [
    "When a side-panel drawer form factor is more appropriate — use AIAgentDrawer instead",
    "When you need a full-page experience with routing — use the ai-command-center page pattern",
    "Do not invent dependency atomics — use bundled canonical sources",
    "Do not hardcode brand hex — use AI tokens",
    "Do not require an external AI UI package for agent implementations — use co-located TSX"
  ],
  "governance": {
    "namespace": "ai",
    "brand": "Guild",
    "closedWorldIndexed": false,
    "agentRules": [],
    "related": [],
    "experienceMetadata": {
      "experienceMode": [
        "AI Assisted",
        "Adaptive",
        "AI Led"
      ],
      "accountability": [
        "Audit trail"
      ]
    }
  },
  "sources": {
    "spec": "design-system/components/ai/organisms/ai-command-center-dialog/ai-command-center-dialog.md",
    "manifest": "design-system/components/ai/organisms/ai-command-center-dialog/ai-command-center-dialog.agent.json",
    "implementation": "src/components/ai/organisms/ai-command-center-dialog/AICommandCenterDialog.tsx",
    "prompt": "design-system/components/ai/organisms/ai-command-center-dialog/agentic-prompt.md",
    "preview": "design-system/components/ai/organisms/ai-command-center-dialog/ai-command-center-dialog.preview.html",
    "contract": "design-system/components/ai/organisms/ai-command-center-dialog/ai-command-center-dialog.contract.json"
  },
  "gaps": [
    {
      "field": "figma",
      "reason": "No Figma file, node, or Code Connect mapping in the spec or manifest."
    },
    {
      "field": "codeConnect",
      "reason": "No Code Connect mapping declared."
    },
    {
      "field": "states",
      "reason": "No states declared in manifest, source unions, or spec table."
    },
    {
      "field": "tokens",
      "reason": "No Guild semantic tokens declared in the manifest or extracted from TSX. Not guessed."
    },
    {
      "field": "a11y",
      "reason": "Manifest accessibility block is a generic placeholder, not a reviewed contract."
    }
  ],
  "origin": {
    "generated": true,
    "curated": false,
    "generatedAt": "2026-09-15T00:18:05.777Z",
    "from": [
      "md",
      "agent.json",
      "tsx",
      "tsx-props"
    ]
  }
}
